Name,skill ID,Is the stimulus (support material) appropriate?,Does the prompt reflect the assessed skill?,Is the correct answer accurate?,Is there a single correct answer?,Is there parallelism among the alternatives?,Are the distractors plausible?,Are the justifications coherent?,Do the alternatives include elements not present in the stimulus?,Is the item adequately aligned with the assessed skill?,Could the item be used in an assessment with little or no modification?,Observation (English),Observation (Original)
06_A.txt,CL22-5EF-CL33,Yes,TRUE,TRUE,TRUE,FALSE,TRUE,TRUE,FALSE,TRUE,TRUE,The alternatives are not plausible in terms of length.,As alternativas não são plausíveis quanto à extensão.
07_A.txt,CL22-5EF-CL33,Yes,TRUE,TRUE,TRUE,FALSE,FALSE,TRUE,FALSE,TRUE,TRUE,"Although plausibility is better in this item compared to the previous one, the answer key stands out due to its length.","Embora a plausibilidade esteja melhor neste item, comparado ao anterior, o gabarito chama atenção pela extensão."
08_A.txt,CL22-5EF-CL33,Yes,TRUE,TRUE,TRUE,FALSE,TRUE,TRUE,FALSE,TRUE,TRUE,"This is the best-constructed item: the AI trims the answer key, meeting the plausibility criterion (length), and selects excerpts with only one conjunction.","Este é o item com a melhor construção: a IA faz um corte no gabarito, o que atende ao critério de plausibilidade - extensão - e seleciona trechos com apenas uma conjunção. "
09_A.txt,CL22-5EF-CL33,Yes,TRUE,TRUE,TRUE,FALSE,TRUE,TRUE,FALSE,TRUE,TRUE,"In this item, the AI begins the alternatives with logical-discursive relation markers, with the answer key being longer. Thus, the issue of parallelism among the alternatives remains, which compromises plausibility.","Neste item a IA inicia as alternativas com os marcadores de relação lógico-discursiva, sendo o gabarito de maior extensão. Nesse sentido, permanece a questão do paralelismo entre as alternativas, o que compromete a plausibilidade."
10_A.txt,CL22-5EF-CL33,Yes,TRUE,TRUE,TRUE,FALSE,FALSE,TRUE,FALSE,TRUE,FALSE,Same issue of parallelism. The logical-discursive marker in alternative C was created by the AI.,Mesma questão de paralelismo. O marcador de relação lógico-discursiva da alternativa C foi criado pela IA
16_A.txt,CL22-5EF-CL33,Yes,TRUE,TRUE,TRUE,FALSE,FALSE,TRUE,TRUE,FALSE,FALSE,Alternatives A and D were modified by the AI. Alternative A loses parallelism.,Alternativa A e D alteradas pela IA. Alternativa A perde paralelismo. 
17_A.txt,CL22-5EF-CL33,Yes,TRUE,TRUE,TRUE,FALSE,FALSE,TRUE,TRUE,FALSE,FALSE,"Here, the AI alters the answer key, transforming the conditional relation into a negative. This further compromises plausibility compared to previous constructions, making the answer key even more attractive than when a cohesive link was inserted.","Aqui a IA altera a alternativa que é gabarito, transformando a relação de condição em uma negativa. Maior comprometimento da plausibilidade do item, em relação a todasm as construções anteriores, pois torna o gabarito ainda mais atrativo do que quando ela inseriu o elo coesivo, por exemplo."
18_A.txt,CL22-5EF-CL33,Yes,TRUE,TRUE,TRUE,FALSE,FALSE,TRUE,TRUE,FALSE,FALSE,"Here, the AI also alters the structure of the answer key, working with the idea in the text regarding the condition for the girl's qualification in the tournament.","Aqui a IA também altera a estrutura do gabarito, trabalhando com a ideia do texto sobre a condição para a classificação da menina no torneio."
19_A.txt,CL22-5EF-CL33,Yes,TRUE,TRUE,TRUE,FALSE,TRUE,TRUE,TRUE,TRUE,TRUE,Best construction by the AI: aligned with the template.,Melhor construção da IA: alinhada ao template.
20_A.txt,CL22-5EF-CL33,Yes,FALSE,FALSE,FALSE,FALSE,FALSE,FALSE,FALSE,FALSE,FALSE,"The answer key is incorrect: “when” can be a conditional marker, but not in this example. Item discarded.","O gabarito está incorreto: quando pode ser marcador de condição, mas não no caso do exemplo. Item eliminado."
21_A.txt,CL22-5EF-CL33,Yes,TRUE,TRUE,TRUE,FALSE,TRUE,TRUE,TRUE,TRUE,TRUE,"The news about the picnic does not present a source. Best AI construction: the item meets the skill, but still has the parallelism issue (length).","A notícia sobre o piquenique não apresenta fonte. Melhor construção da IA: o item atende a habilidade, mas mantém a questão do paralelismo - extensão."
22_A.txt,CL22-5EF-CL33,Yes,TRUE,TRUE,TRUE,FALSE,FALSE,TRUE,FALSE,FALSE,FALSE,The AI adds a time marker (“During the picnic”) to all alternatives and adapts them using elements from the text.,"A IA acrescenta em todas as alternativas um marcador de tempo  ""Durante o piquenique"" e adequa as alternativas trabalhando com elementos do texto."
23_A.txt,CL22-5EF-CL33,Yes,TRUE,TRUE,TRUE,FALSE,FALSE,TRUE,FALSE,FALSE,FALSE,The AI also modifies the alternatives by incorporating elements from the text and adding cohesive links that are not present in the original text.,A IA também altera as alternativas dialogando com elementos do texto e acresentando elos coesivos que não estão no texto.
24_A.txt,CL22-5EF-CL33,Yes,TRUE,TRUE,TRUE,TRUE,FALSE,TRUE,FALSE,FALSE,FALSE,The AI modifies elements of the alternatives but keeps the answer key intact. Alternative A changes verb tense; alternative B modifies the ending (summarizes); alternative C omits a segment. These changes result in good syntactic parallelism with balanced length.,"A IA altera elementos das alternativas, mas mantém o gabarito na íntegra. Alternativa A - altera tempo verbal; alternatiba B modifica parte final - faz uma síntese; alterantiva C - suprime trecho. O resultado dessas mudanças gera um bom paralelismo sintático com equilíbrio na extensão. "
25_A.txt,CL22-5EF-CL33,Yes,TRUE,TRUE,TRUE,TRUE,FALSE,TRUE,TRUE,TRUE,TRUE,"Construction identical to item 23, with variation in the order of alternatives.",Construção idêntica a do item 23 com alternância na ordem das alternativas. 
26_A.txt,CL22-5EF-CL33,Yes,TRUE,TRUE,TRUE,FALSE,FALSE,FALSE,FALSE,FALSE,TRUE,"The alternatives are not plausible, as the connector “and” used in two of the four alternatives indicates addition of elements rather than clauses. Additionally, the third distractor (D) contains two connectors. Only the answer key aligns with the template description, but it includes a cut from the text that was not indicated by the AI.","As alternativas não são plausíveis , pois o conector ""e"" usado em duas das 4 alternativas indica a soma de elementos e não de duas orações. Além disso, o terceiro distrator - letra D - apresenta dois conectores. Somente o gabarito está alinhado à descrição do template, mas apresenta um corte em relação ao trecho no texto, não indicado pela IA."
27_A.txt,CL22-5EF-CL33,Yes,TRUE,TRUE,TRUE,TRUE,FALSE,TRUE,FALSE,TRUE,FALSE,"The alternatives are plausible in terms of length, but alternative C does not include a conjunction as claimed in the justification. The answer key is the same as in the previous item, now fully restored.","As alternativas estão plausíveis em termos de extensão, mas a alternativa C não apresenta conjunção como apontado pela IA na justificativa. O gabarito é o mesmo do item anterior, agora recuperado na íntegra."
28_A.txt,CL22-5EF-CL33,Yes,TRUE,TRUE,TRUE,TRUE,FALSE,TRUE,FALSE,TRUE,FALSE,Same structure as previous items with the same text; one alternative is not plausible due to the absence of a conjunction.,"Mesmo desenho dos itens anteriores com o mesmo texto, ou seja, uma das alterantivas não é plausíveil pela ausência de conjunção. "
29_A.txt,CL22-5EF-CL33,Yes,TRUE,TRUE,TRUE,TRUE,FALSE,TRUE,FALSE,TRUE,FALSE,"Same structure as previous items with the same text; one alternative is not plausible due to the absence of a conjunction. The AI rearranges the order, changing the position of the answer key.","Mesmo desenho dos itens anteriores com o mesmo texto, ou seja, uma das alterantivas não é plausíveil pela ausência de conjunção. A IA combina a ordem, alternando a posição do gabarito."
30_A.txt,CL22-5EF-CL33,Yes,TRUE,TRUE,TRUE,TRUE,FALSE,TRUE,FALSE,TRUE,FALSE,"Same as previous comments. None of the items produced by the AI with this text (items 26–30) would be recommended, because it is not possible to produce four alternatives while maintaining the template requirement that all express different logical-discursive relations.","Idem aos comentários anteriores. Não indicaria nenhum dos itens elaborados pela IA com o texto -itens 26 a 30 - pelo fato de não ser possível 4 alternativas de resposta, mantendo as orientações do template - todas terem outras relações lógico-discursivas. "
36_A.txt,CL22-5EF-CL33,Yes,TRUE,FALSE,TRUE,FALSE,TRUE,TRUE,FALSE,FALSE,FALSE,"The answer key corresponds to a modified excerpt of the text, which differentiates it from the other alternatives. There is no parallelism among the alternatives—they differ significantly in length.","O gabarito corresponde a um trecho modificado do texto, o que também o diferencia das demais alternativas. Não há paralelismo entre as alterantivas - diferem bastante no tamanho."
37_A.txt,CL22-5EF-CL33,Yes,TRUE,TRUE,TRUE,FALSE,TRUE,TRUE,FALSE,FALSE,TRUE,Lack of parallelism — length of alternatives.,Falta paralelismo/ tamanho das alternativas
38_A.txt,CL22-5EF-CL33,Yes,TRUE,FALSE,TRUE,TRUE,FALSE,TRUE,TRUE,FALSE,FALSE,"The answer options are paraphrases of excerpts from the text, and the command asks for recognition of a text excerpt expressing a conditional idea. Therefore, the alternatives do not correspond to what the command requires.","As alternativas de resposta são paráfrases de trechos do texto, e o comando solicita o reconhecimento do trecho do texto com ideia de condição. Portanto, as alternativas não correspondem ao que o comando solicita. "
39_A.txt,CL22-5EF-CL33,Yes,TRUE,FALSE,TRUE,FALSE,FALSE,TRUE,TRUE,FALSE,FALSE,The answer key is a paraphrase of a statement from the text and not an excerpt taken directly from it. It has also already been used in previous items. There is no parallelism among the alternatives (length).,"O gabarito é uma paráfrase de um enunciado do texto e não um trecho retirado do texto. O gabarito, enquanto um trecho do texto,  também já foi utilizado em itens anteriores. Não há paralelismo entre os alternativas (tamanho) "
40_A.txt,CL22-5EF-CL33,Yes,TRUE,TRUE,TRUE,FALSE,FALSE,TRUE,TRUE,FALSE,FALSE,"Distractor C corresponds to a modified excerpt of the text, conflicting with the command and even with the model item. There is no parallelism among the alternatives (length).","O distrator C corresponte a um trecho modificado do texto, ficando em desacordo com o comando e mesmo com o item modelar. Não há paralelismo entre as alterantivas (tamanho)"
46_A.txt,CL22-5EF-CL33,Yes,TRUE,FALSE,FALSE,TRUE,TRUE,TRUE,TRUE,FALSE,FALSE,"The answer key is incorrect because the conjunction “sem que” does not express condition. The alternatives significantly modify the text excerpts, weakening their relation to the command and contradicting the item template.","O gabarito está incorreto, pois a conjunção ""sem que"" não tem valor condicional. As alternativas de resposta modificam bastante os trechos do texto, prejudicando sua relação com o comando e contrariando a orientação do modelo de item."
47_A.txt,CL22-5EF-CL33,Yes,TRUE,FALSE,FALSE,FALSE,TRUE,FALSE,TRUE,FALSE,FALSE,"The answer key is incorrect because the conjunction “sem que” does not express condition. The alternatives are not excerpts from the text, contradicting the template guidelines. They are paraphrases. There is no parallelism among the alternatives.","O gabarito está incorreto, pois a conjunção ""sem que"" não tem valor condicional. As alternativas de resposta não correspondem a trechos do texto, contrariando orientação do template. São paráfrases. Não há paralelismo entre as alternativas. "
49_A.txt,CL22-5EF-CL33,Yes,TRUE,FALSE,FALSE,FALSE,FALSE,TRUE,TRUE,FALSE,FALSE,"The answer key modifies the text excerpt by replacing the temporal conjunction “after” with the conditional “if,” thereby turning the clause into a conditional. The alternatives are not excerpts from the text, and there is no parallelism among them.","O gabarito do item modifica o trecho do texto, trocando a conjunção temporal ""depois de"", por uma condicional ""se"", de modo a transformar a oranção em condicional. As alternativas não correspondem a trechos do texto. Além disso, não há paralelismo entre as alternativas. "
48_A.txt,CL22-5EF-CL33,Yes,TRUE,FALSE,FALSE,FALSE,FALSE,FALSE,TRUE,FALSE,FALSE,"The answer key modifies the text excerpt by replacing the temporal conjunction “after” with the conditional “if,” thereby turning the clause into a conditional. Additionally, alternatives A and D are, as in other cases, paraphrases of the same excerpt from the text.","O gabarito do item modifica o trecho do texto, trocando a conjunção temporal ""depois de"", por uma condicional ""se"", de modo a transformar a oranção em condicional. Além disso, as alternativas A e D são, como em outros casos, paráfrases do mesmo trecho do texto. "
50_A.txt,CL22-5EF-CL33,Yes,TRUE,FALSE,FALSE,FALSE,FALSE,FALSE,TRUE,FALSE,FALSE,"The item has no valid answer: the selected answer involves an incorrect analysis of the word “se,” which is clearly not a conditional conjunction. The alternatives are not excerpts from the text. There is no parallelism among the alternatives (length).","O item não tem gabarito: a indicação da alternativa como gabarito envolve um erro de análise da palavra ""se"", que evidentemente não é uma conjunção condicional. As alternativas não correspondem a trecnos do texto. Não há paralelismo entre as alternativas (tamanho)."
51_A.txt,CL22-5EF-CL33,Yes,TRUE,TRUE,TRUE,FALSE,TRUE,TRUE,FALSE,TRUE,TRUE,"Lack of parallelism: alternative B (the answer key) is much longer than the others, making it stand out.","Falta paralelismo: a alternativa B, gabarito, é bem maior que as demais, ganhando destaque."
52_A.txt,CL22-5EF-CL33,Yes,TRUE,TRUE,TRUE,TRUE,FALSE,FALSE,TRUE,FALSE,FALSE,"The item cannot be used because the answer alternatives are not excerpts from the text, which contradicts both the command and the template guidelines. Additionally, item 52 is practically identical to the previous one. Justification A is incorrect, as “que” is not an explanatory conjunction but a relative pronoun.","O item não pode ser utilizado porque as alterantivas de resposta não correspondem a trechos retirados do texto, o que contraria o comando do item e a orientação do template. Além disso, o item 52 é praticamente igual ao anteiror. A justificativa de A está incorreta, pois o ""que"" não é uma conjunção explicativa, mas um pronome relativo. "
53_A.txt,CL22-5EF-CL33,Yes,TRUE,TRUE,TRUE,TRUE,FALSE,TRUE,TRUE,,FALSE,"The item cannot be used because the answer alternatives are not excerpts from the text, which contradicts both the command and the template guidelines. Additionally, item 53 is practically identical to previous items.","O item não pode ser utilizado porque as alterantivas de resposta não correspondem a trechos retirados do texto, o que contraria o comando do item e a orientação do template. Além disso, o item 53 é praticamente igual aos anteirores. "
54_A.txt,CL22-5EF-CL33,Yes,TRUE,TRUE,TRUE,TRUE,FALSE,TRUE,TRUE,FALSE,FALSE,"The item cannot be used because the answer alternatives are not excerpts from the text, which contradicts both the command and the template guidelines. Additionally, item 54 is practically identical to previous items.","O item não pode ser utilizado porque as alterantivas de resposta não correspondem a trechos retirados do texto, o que contraria o comando do item e a orientação do template. Além disso, o item 54 é praticamente igual aos anteirores. "
55_A.txt,CL22-5EF-CL33,Yes,TRUE,TRUE,TRUE,TRUE,FALSE,TRUE,TRUE,FALSE,FALSE,"The item cannot be used because the answer alternatives are not excerpts from the text, which contradicts both the command and the template guidelines. Additionally, item 55 is practically identical to previous items.","O item não pode ser utilizado porque as alterantivas de resposta não correspondem a trechos retirados do texto, o que contraria o comando do item e a orientação do template. Além disso, o item 55 é praticamente igual aos anteirores. "
56_A.txt,CL22-5EF-CL33,Yes,TRUE,TRUE,TRUE,TRUE,FALSE,TRUE,TRUE,FALSE,FALSE,"The item cannot be used because some answer alternatives are not excerpts from the text, which contradicts both the command and the template guidelines.","O item não pode ser utilizado porque algumas alterantivas de resposta não correspondem a trechos retirados do texto, o que contraria o comando do item e a orientação do template."
57_A.txt,CL22-5EF-CL33,Yes,TRUE,TRUE,TRUE,FALSE,TRUE,TRUE,TRUE,TRUE,TRUE,Break in parallelism in one of the alternatives.,Quebra de paralelismo em uma das alterantivas
58_A.txt,CL22-5EF-CL33,Yes,TRUE,TRUE,TRUE,FALSE,TRUE,TRUE,TRUE,FALSE,TRUE,"The item could be used provided that the correct alternative is revised, since it does not correspond to an excerpt from the text, contradicting the command. Even so, it would be very similar to the other items in the group.","O item pode ser utilizado na condição de se refazer a alternativa correta, que não corresponde a um trecho do texto, contrariando seu comando. Ainda asYes, ficaria muito parecido com os demais itens do grupo."
59_A.txt,CL22-5EF-CL33,Yes,TRUE,TRUE,TRUE,TRUE,FALSE,TRUE,TRUE,FALSE,FALSE,"The item cannot be used because some answer alternatives are not excerpts from the text, which contradicts both the command and the template guidelines.","O item não pode ser utilizado porque algumas alterantivas de resposta não correspondem a trechos retirados do texto, o que contraria o comando do item e a orientação do template."
60_A.txt,CL22-5EF-CL33,Yes,TRUE,TRUE,TRUE,FALSE,TRUE,TRUE,FALSE,TRUE,TRUE,"Among the group of items, this is the only one that uses actual excerpts from the text. The others are paraphrases or modified excerpts.","Do conjunto de itens do grupo, este é o único que recorta trechos do texto. Os demais são paráfrases ou mesmo trecho com o sentido modificado"
61_A.txt,CL22-5EF-CL33,Yes,TRUE,TRUE,TRUE,TRUE,TRUE,TRUE,FALSE,TRUE,TRUE,,
62_A.txt,CL22-5EF-CL33,Yes,TRUE,TRUE,TRUE,TRUE,FALSE,FALSE,TRUE,FALSE,FALSE,"The item cannot be used because some answer alternatives are not excerpts from the text, which contradicts both the command and the template guidelines. Justification D is incorrect.","O item não pode ser utilizado porque algumas alterantivas de resposta não correspondem a trechos retirados do texto, o que contraria o comando do item e a orientação do template. A justificativa de D está incorreta. Duas "
63_A.txt,CL22-5EF-CL33,Yes,TRUE,TRUE,TRUE,TRUE,TRUE,FALSE,FALSE,TRUE,FALSE,"The item is practically identical to item 61, and justification D is incorrect.",O item é praticamente idêntico ao 61 e a justificativa D está incorreta.
64_A.txt,CL22-5EF-CL33,Yes,TRUE,TRUE,TRUE,TRUE,FALSE,TRUE,TRUE,FALSE,FALSE,"The item cannot be used because some answer alternatives are not excerpts from the text, which contradicts both the command and the template guidelines.","O item não pode ser utilizado porque  algumas alterantivas de resposta não correspondem a trechos retirados do texto, o que contraria o comando do item e a orientação do template. "
65_A.txt,CL22-5EF-CL33,Yes,TRUE,TRUE,TRUE,TRUE,FALSE,TRUE,TRUE,FALSE,FALSE,"The item cannot be used because some answer alternatives are not excerpts from the text, which contradicts both the command and the template guidelines.","O item não pode ser utilizado porque  algumas alterantivas de resposta não correspondem a trechos retirados do texto, o que contraria o comando do item e a orientação do template. "
66_A.txt,CL22-5EF-CL33,Yes,TRUE,TRUE,TRUE,TRUE,TRUE,TRUE,FALSE,TRUE,TRUE,,
67_A.txt,CL22-5EF-CL33,Yes,TRUE,TRUE,TRUE,TRUE,FALSE,TRUE,TRUE,FALSE,FALSE,"The item cannot be used because some answer alternatives are not excerpts from the text, which contradicts both the command and the template guidelines.","O item não pode ser utilizado porque algumas alterantivas de resposta não correspondem a trechos retirados do texto, o que contraria o comando do item e a orientação do template. "
68_A.txt,CL22-5EF-CL33,Yes,TRUE,TRUE,TRUE,TRUE,FALSE,TRUE,TRUE,FALSE,FALSE,"The item cannot be used because some answer alternatives are not excerpts from the text, which contradicts both the command and the template guidelines.","O item não pode ser utilizado porque algumas alterantivas de resposta não correspondem a trechos retirados do texto, o que contraria o comando do item e a orientação do template. "
69_A.txt,CL22-5EF-CL33,Yes,TRUE,TRUE,TRUE,TRUE,FALSE,FALSE,TRUE,FALSE,FALSE,"The item cannot be used because some answer alternatives are not excerpts from the text, which contradicts both the command and the template guidelines. There is an error in justification B.","O item não pode ser utilizado porque algumas alterantivas de resposta não correspondem a trechos retirados do texto, o que contraria o comando do item e a orientação do template. Há erro na justificativa B."
70_A.txt,CL22-5EF-CL33,Yes,TRUE,TRUE,TRUE,TRUE,FALSE,TRUE,TRUE,FALSE,FALSE,"The item cannot be used because some answer alternatives are not excerpts from the text, which contradicts both the command and the template guidelines.","O item não pode ser utilizado porque algumas alterantivas de resposta não correspondem a trechos retirados do texto, o que contraria o comando do item e a orientação do template. "